{
  "$schema": "https://json-schema.org/draft/2020-12/schema",
  "$id": "https://github.com/squid-protocol/cics-crucible/schema/case.schema.json",
  "title": "cics-crucible case (format cics-crucible/case/1)",
  "type": "object",
  "required": ["format", "id", "trap", "title", "clock", "terminal", "sources", "layouts", "maps", "scenarios"],
  "additionalProperties": false,
  "properties": {
    "format": {"const": "cics-crucible/case/1"},
    "origin": {
      "type": "object",
      "required": ["applid", "userid", "facilname", "networkid", "faciltype"],
      "additionalProperties": false,
      "properties": {
        "applid": {"$ref": "#/$defs/name8"},
        "userid": {"$ref": "#/$defs/name8"},
        "facilname": {"$ref": "#/$defs/name8"},
        "networkid": {"$ref": "#/$defs/name8"},
        "faciltype": {"enum": ["APPC", "ASRUNTRAN", "BRIDGE", "EVENT", "IIOP", "IPECI", "IPIC", "JVMSERVER", "LU61", "MRO", "NODEJSAPP", "NONE", "RRSUR", "RZINSTOR", "SCHEDULER", "SOCKET", "START", "STARTTERM", "TERMINAL", "TRANDATA", "WEB", "XMRUNTRAN"]}
      }
    },
    "id": {"type": "string", "pattern": "^[a-z0-9]+(-[a-z0-9]+)*$"},
    "trap": {"enum": ["condition-handling", "hex-attributes", "commarea-mismatch", "ghost-tasks", "pseudo-conversational"]},
    "title": {"type": "string", "minLength": 1},
    "clock": {"$ref": "#/$defs/timestamp"},
    "terminal": {"$ref": "#/$defs/name4"},
    "sources": {
      "type": "object",
      "required": ["cobol", "bms", "csd", "copy", "data"],
      "additionalProperties": false,
      "properties": {
        "cobol": {"type": "array", "minItems": 1, "items": {"type": "string", "pattern": "^src/[A-Z0-9#@$]{1,8}\\.cbl$"}},
        "bms": {"type": "array", "items": {"type": "string", "pattern": "^bms/[A-Z0-9#@$]{1,8}\\.bms$"}},
        "csd": {"type": "array", "minItems": 1, "items": {"type": "string", "pattern": "^csd/[a-z0-9-]+\\.csd$"}},
        "copy": {"type": "array", "items": {"type": "string", "pattern": "^copy$"}},
        "data": {"type": "array", "items": {"type": "string", "pattern": "^data/"}}
      }
    },
    "layouts": {
      "type": "object",
      "additionalProperties": {
        "type": "object",
        "required": ["source", "record"],
        "additionalProperties": false,
        "properties": {
          "source": {"type": "string", "pattern": "^(copy|src)/"},
          "record": {"$ref": "#/$defs/cobolname"}
        }
      }
    },
    "maps": {
      "type": "object",
      "additionalProperties": {
        "type": "object",
        "required": ["mapset", "copybook"],
        "additionalProperties": false,
        "properties": {
          "mapset": {"$ref": "#/$defs/name8"},
          "copybook": {"type": "string", "pattern": "^copy/"}
        }
      }
    },
    "peers": {
      "type": "object",
      "propertyNames": {"$ref": "#/$defs/peername"},
      "additionalProperties": {
        "type": "object",
        "required": ["responses"],
        "additionalProperties": false,
        "properties": {
          "responses": {"type": "array", "minItems": 1, "items": {"$ref": "#/$defs/peerresponse"}},
          "note": {"type": "string"}
        }
      }
    },
    "undefined_programs": {"type": "array", "items": {"$ref": "#/$defs/name8"}},
    "unheld_maps": {"type": "array", "items": {"$ref": "#/$defs/name8"}},
    "scenarios": {"type": "array", "minItems": 1, "items": {"$ref": "#/$defs/scenario"}}
  },
  "$defs": {
    "timestamp": {"type": "string", "pattern": "^\\d{4}-\\d{2}-\\d{2}T\\d{2}:\\d{2}:\\d{2}$"},
    "name4": {"type": "string", "pattern": "^[A-Z0-9#@$]{1,4}$"},
    "name8": {"type": "string", "pattern": "^[A-Z0-9#@$]{1,8}$"},
    "cobolname": {"type": "string", "pattern": "^[A-Z0-9][A-Z0-9-]*$"},
    "peername": {"type": "string", "pattern": "^[a-z0-9]+(-[a-z0-9]+)*$"},
    "peerresponse": {
      "type": "object",
      "required": ["status"],
      "additionalProperties": false,
      "properties": {
        "status": {"type": "integer", "minimum": 100, "maximum": 599},
        "mediatype": {"type": "string", "minLength": 1},
        "body": {"type": "string"},
        "headers": {"type": "object", "minProperties": 1,
                    "propertyNames": {"pattern": "^[A-Za-z0-9-]{1,64}$"},
                    "additionalProperties": {"type": "string", "minLength": 1}},
        "note": {"type": "string"}
      }
    },
    "request": {
      "type": "object",
      "required": ["at", "peer", "method", "scheme", "host", "path"],
      "additionalProperties": false,
      "properties": {
        "at": {"type": "integer", "minimum": 0},
        "peer": {"$ref": "#/$defs/peername"},
        "method": {"enum": ["GET", "HEAD", "POST", "PUT", "DELETE"]},
        "scheme": {"const": "HTTP"},
        "host": {"type": "string", "pattern": "^[A-Za-z0-9.-]{1,116}$"},
        "path": {"type": "string", "pattern": "^/[^\\s?*]{0,254}$"},
        "mediatype": {"type": "string", "minLength": 1},
        "body": {"type": "string"},
        "query": {"type": "string", "pattern": "^[^\\s?]{1,254}$"},
        "headers": {"type": "object", "minProperties": 1,
                    "propertyNames": {"pattern": "^[A-Za-z0-9-]{1,64}$"},
                    "additionalProperties": {"type": "string", "minLength": 1}},
        "note": {"type": "string"}
      }
    },
    "aid": {"enum": ["ENTER", "CLEAR", "PA1", "PA2", "PA3",
                     "PF1", "PF2", "PF3", "PF4", "PF5", "PF6", "PF7", "PF8", "PF9", "PF10", "PF11", "PF12",
                     "PF13", "PF14", "PF15", "PF16", "PF17", "PF18", "PF19", "PF20", "PF21", "PF22", "PF23", "PF24"]},
    "scenario": {
      "type": "object",
      "required": ["id", "summary", "path", "steps"],
      "additionalProperties": false,
      "properties": {
        "id": {"type": "string", "pattern": "^[a-z0-9]+(-[a-z0-9]+)*$"},
        "summary": {"type": "string", "minLength": 1},
        "path": {"enum": ["happy", "trap"]},
        "initial": {
          "type": "object",
          "additionalProperties": false,
          "properties": {
            "ts_queues": {"type": "object", "additionalProperties": {"type": "array", "items": {"$ref": "#/$defs/tsitem"}}},
            "td_queues": {"type": "object", "propertyNames": {"$ref": "#/$defs/name4"}, "additionalProperties": {"type": "array", "items": {"$ref": "#/$defs/tsitem"}}}
          }
        },
        "requests": {"type": "array", "minItems": 1, "items": {"$ref": "#/$defs/request"}},
        "steps": {"type": "array", "items": {"$ref": "#/$defs/step"}},
        "until": {"type": "integer", "minimum": 0}
      }
    },
    "tsitem": {
      "oneOf": [
        {"type": "string"},
        {"type": "object", "required": ["hex"], "additionalProperties": false,
         "properties": {"hex": {"type": "string", "pattern": "^([0-9A-F]{2})*$"}}}
      ]
    },
    "step": {
      "type": "object",
      "required": ["at", "aid"],
      "additionalProperties": false,
      "properties": {
        "at": {"type": "integer", "minimum": 0},
        "aid": {"$ref": "#/$defs/aid"},
        "text": {"type": "string"},
        "map": {"$ref": "#/$defs/name8"},
        "fields": {
          "type": "object",
          "additionalProperties": {"type": "string"}
        },
        "cursor": {"type": "string"},
        "note": {"type": "string"}
      }
    }
  }
}
