{
  "format": "cics-crucible/case/1",
  "id": "hc-resp-options",
  "trap": "condition-handling",
  "title": "RESP on FORMATTIME (INVREQ RESP2 1 for ABSTIME below zero), ASKTIME NOHANDLE with no ABSTIME, READQ TS LENGTH(LENGTH OF area) (LENGERR truncation), RECEIVE MAP ... ASIS keeps lower case",
  "clock": "2026-03-02T10:00:00",
  "terminal": "T001",
  "sources": {
    "cobol": [
      "src/HCOPT.cbl"
    ],
    "bms": [
      "bms/HCSET1.bms"
    ],
    "csd": [
      "csd/hc-resp-options.csd"
    ],
    "copy": [
      "copy"
    ],
    "data": []
  },
  "layouts": {},
  "maps": {
    "HCM1": {
      "mapset": "HCSET1",
      "copybook": "copy/HCSET1.cpy"
    }
  },
  "scenarios": [
    {
      "id": "formattime",
      "path": "happy",
      "summary": "ASKTIME NOHANDLE (no ABSTIME) and ASKTIME ABSTIME; FORMATTIME with RESP / RESP2 on the clock's ABSTIME (NORMAL) and on an ABSTIME of -1 (INVREQ RESP2 1)",
      "steps": [
        {
          "at": 0,
          "aid": "ENTER",
          "text": "HC51 F"
        }
      ],
      "until": 60
    },
    {
      "id": "readq-length",
      "path": "happy",
      "summary": "READQ TS INTO(12 bytes) LENGTH(LENGTH OF it) of a 20-byte item (LENGERR, truncated) and of a 12-byte item (NORMAL)",
      "steps": [
        {
          "at": 0,
          "aid": "ENTER",
          "text": "HC51 Q"
        }
      ],
      "until": 60
    },
    {
      "id": "asis",
      "path": "happy",
      "summary": "SEND MAP, then RECEIVE MAP ... ASIS of mixed-case input on a UCTRAN(YES) terminal: the lower case is not translated",
      "steps": [
        {
          "at": 0,
          "aid": "ENTER",
          "text": "HC51 A"
        },
        {
          "at": 10,
          "aid": "ENTER",
          "map": "HCM1",
          "fields": {
            "NAME": "Mixed cAsE"
          }
        }
      ],
      "until": 60
    }
  ]
}
