{
  "format": "cics-crucible/case/1",
  "id": "hc-abend-link",
  "trap": "condition-handling",
  "title": "HANDLE CONDITION / HANDLE ABEND across LINK levels, abend exits at a higher level, PUSH and POP HANDLE",
  "clock": "2026-03-02T10:00:00",
  "terminal": "T001",
  "sources": {"cobol": ["src/HCMAIN.cbl", "src/HCSUB.cbl"], "bms": [], "csd": ["csd/hc-abend-link.csd"],
              "copy": ["copy"], "data": []},
  "layouts": {"LINKCA": {"source": "src/HCMAIN.cbl", "record": "WS-CA"}},
  "maps": {},
  "scenarios": [
    {"id": "sub-resp", "path": "happy",
     "summary": "HCSUB tests QIDERR with RESP; back in HCMAIN the QIDERR handler is in force again",
     "initial": {"ts_queues": {"HCMODE": ["N"]}},
     "steps": [{"at": 0, "aid": "ENTER", "text": "HC02"}]},
    {"id": "sub-unhandled", "path": "trap",
     "summary": "HCSUB raises QIDERR without RESP: HCMAIN's handler is not inherited, the task abends AEYH in HCSUB, and HCMAIN's HANDLE ABEND LABEL exit (one level up) gets control",
     "initial": {"ts_queues": {"HCMODE": ["Q"]}},
     "steps": [{"at": 0, "aid": "ENTER", "text": "HC02"}]},
    {"id": "sub-own-exit", "path": "trap",
     "summary": "HCSUB sets its own abend exit, ABENDs with HCX1, recovers in the exit and RETURNs normally to HCMAIN",
     "initial": {"ts_queues": {"HCMODE": ["A"]}},
     "steps": [{"at": 0, "aid": "ENTER", "text": "HC02"}]},
    {"id": "push-pop", "path": "happy",
     "summary": "PUSH HANDLE then POP HANDLE: the QIDERR handler is back after the POP",
     "initial": {"ts_queues": {"HCMODE": ["O"]}},
     "steps": [{"at": 0, "aid": "ENTER", "text": "HC02"}]},
    {"id": "pushed-abend", "path": "trap",
     "summary": "QIDERR while handlers are PUSHed: neither the QIDERR handler nor the HANDLE ABEND exit is in effect, so the task terminates with AEYH",
     "initial": {"ts_queues": {"HCMODE": ["P"]}},
     "steps": [{"at": 0, "aid": "ENTER", "text": "HC02"}]}
  ]
}
